{
  "environment_kind": "grid",
  "task_kind": "reforestation",
  "preview_payload": {
    "terrain_map": [
      [
        0.0,
        0.0,
        0.0,
        0.0,
        0.0,
        0.0,
        0.0,
        0.0,
        0.0,
        0.0,
        0.0,
        0.0
      ],
      [
        1.0,
        0.0,
        0.0,
        0.0,
        0.0,
        0.0,
        0.0,
        0.0,
        0.0,
        0.0,
        0.0,
        0.0
      ],
      [
        0.0,
        0.0,
        0.0,
        0.0,
        0.0,
        0.0,
        1.0,
        1.0,
        0.0,
        0.0,
        0.0,
        1.0
      ],
      [
        0.0,
        0.0,
        0.0,
        0.0,
        0.0,
        0.0,
        0.0,
        0.0,
        1.0,
        0.0,
        1.0,
        0.0
      ],
      [
        0.0,
        1.0,
        0.0,
        0.0,
        1.0,
        0.0,
        0.0,
        0.0,
        0.0,
        0.0,
        0.0,
        0.0
      ],
      [
        0.0,
        0.0,
        0.0,
        1.0,
        0.0,
        0.0,
        0.0,
        0.0,
        0.0,
        0.0,
        0.0,
        1.0
      ],
      [
        0.0,
        0.0,
        0.0,
        0.0,
        0.0,
        0.0,
        0.0,
        0.0,
        0.0,
        1.0,
        0.0,
        0.0
      ],
      [
        0.0,
        0.0,
        0.0,
        0.0,
        0.0,
        0.0,
        0.0,
        0.0,
        0.0,
        0.0,
        0.0,
        0.0
      ],
      [
        1.0,
        0.0,
        0.0,
        0.0,
        0.0,
        0.0,
        1.0,
        0.0,
        0.0,
        0.0,
        0.0,
        0.0
      ],
      [
        0.0,
        0.0,
        0.0,
        0.0,
        0.0,
        0.0,
        0.0,
        0.0,
        0.0,
        0.0,
        0.0,
        0.0
      ],
      [
        0.0,
        1.0,
        0.0,
        1.0,
        0.0,
        0.0,
        0.0,
        1.0,
        1.0,
        0.0,
        0.0,
        0.0
      ],
      [
        0.0,
        0.0,
        0.0,
        0.0,
        0.0,
        0.0,
        0.0,
        0.0,
        0.0,
        0.0,
        0.0,
        1.0
      ]
    ],
    "agent_pos": [
      [
        2.0,
        2.0
      ]
    ],
    "goal_pos": [
      [
        0.0,
        3.0
      ],
      [
        0.0,
        4.0
      ],
      [
        0.0,
        6.0
      ],
      [
        0.0,
        7.0
      ],
      [
        0.0,
        8.0
      ],
      [
        0.0,
        10.0
      ],
      [
        0.0,
        11.0
      ],
      [
        1.0,
        1.0
      ],
      [
        1.0,
        2.0
      ],
      [
        1.0,
        5.0
      ],
      [
        1.0,
        7.0
      ],
      [
        1.0,
        9.0
      ],
      [
        1.0,
        11.0
      ],
      [
        2.0,
        1.0
      ],
      [
        2.0,
        3.0
      ],
      [
        2.0,
        4.0
      ],
      [
        2.0,
        8.0
      ],
      [
        2.0,
        9.0
      ],
      [
        2.0,
        10.0
      ],
      [
        3.0,
        0.0
      ],
      [
        3.0,
        2.0
      ],
      [
        3.0,
        4.0
      ],
      [
        3.0,
        5.0
      ],
      [
        3.0,
        6.0
      ],
      [
        3.0,
        7.0
      ],
      [
        3.0,
        9.0
      ],
      [
        4.0,
        0.0
      ],
      [
        4.0,
        2.0
      ],
      [
        4.0,
        5.0
      ],
      [
        4.0,
        6.0
      ],
      [
        4.0,
        8.0
      ],
      [
        4.0,
        9.0
      ],
      [
        5.0,
        0.0
      ],
      [
        5.0,
        1.0
      ],
      [
        5.0,
        4.0
      ],
      [
        5.0,
        7.0
      ],
      [
        5.0,
        9.0
      ],
      [
        5.0,
        10.0
      ],
      [
        6.0,
        0.0
      ],
      [
        6.0,
        1.0
      ],
      [
        6.0,
        2.0
      ],
      [
        6.0,
        3.0
      ],
      [
        6.0,
        5.0
      ],
      [
        6.0,
        7.0
      ],
      [
        6.0,
        8.0
      ],
      [
        6.0,
        10.0
      ],
      [
        6.0,
        11.0
      ],
      [
        7.0,
        0.0
      ],
      [
        7.0,
        1.0
      ],
      [
        7.0,
        3.0
      ],
      [
        7.0,
        4.0
      ],
      [
        7.0,
        5.0
      ],
      [
        7.0,
        6.0
      ],
      [
        7.0,
        7.0
      ],
      [
        7.0,
        8.0
      ],
      [
        7.0,
        9.0
      ],
      [
        7.0,
        11.0
      ],
      [
        8.0,
        1.0
      ],
      [
        8.0,
        3.0
      ],
      [
        8.0,
        4.0
      ],
      [
        8.0,
        5.0
      ],
      [
        8.0,
        9.0
      ],
      [
        9.0,
        1.0
      ],
      [
        9.0,
        3.0
      ],
      [
        9.0,
        4.0
      ],
      [
        9.0,
        5.0
      ],
      [
        9.0,
        6.0
      ],
      [
        9.0,
        8.0
      ],
      [
        9.0,
        9.0
      ],
      [
        9.0,
        10.0
      ],
      [
        9.0,
        11.0
      ],
      [
        10.0,
        0.0
      ],
      [
        10.0,
        2.0
      ],
      [
        10.0,
        5.0
      ],
      [
        10.0,
        6.0
      ],
      [
        10.0,
        9.0
      ],
      [
        10.0,
        11.0
      ],
      [
        11.0,
        1.0
      ],
      [
        11.0,
        3.0
      ],
      [
        11.0,
        4.0
      ],
      [
        11.0,
        5.0
      ],
      [
        11.0,
        8.0
      ],
      [
        11.0,
        9.0
      ]
    ],
    "landmark_pos": [
      [
        1.0,
        0.0
      ],
      [
        2.0,
        6.0
      ],
      [
        2.0,
        7.0
      ],
      [
        2.0,
        11.0
      ],
      [
        3.0,
        8.0
      ],
      [
        3.0,
        10.0
      ],
      [
        4.0,
        1.0
      ],
      [
        4.0,
        4.0
      ],
      [
        5.0,
        3.0
      ],
      [
        5.0,
        11.0
      ],
      [
        6.0,
        9.0
      ],
      [
        8.0,
        0.0
      ],
      [
        8.0,
        6.0
      ],
      [
        10.0,
        1.0
      ],
      [
        10.0,
        3.0
      ],
      [
        10.0,
        7.0
      ],
      [
        10.0,
        8.0
      ],
      [
        11.0,
        11.0
      ]
    ]
  },
  "validation_passed": true,
  "validation_messages": [],
  "validation_report": {
    "passed": true,
    "issues": []
  }
}